{
"schema": "aurum.sqlite-offline-profile",
"version": 1,
"profile": "sqlite-offline-v1",
"lock": ".board/locks/oci/sqlite-offline-v1.lock.json",
"lock_digest": "sha256:440e1af3dc3fc74925e8e5fc25e6d04ca284be65d0ef2e22d710bc348209751d",
"network": "none",
"user": "65534:65534",
"cap_drop": "ALL",
"cap_add": "none",
"mounts": "none",
"devices": "none",
"sockets": "none",
"pull": "never",
"tmpfs": "rw,nosuid,nodev",
"checkout_readonly": true,
"read_only_rootfs": true,
"no_new_privileges": true,
"privileged": false,
"timeout_seconds": 60,
"memory_mb": 256,
"cpu_millis": 1000,
"pids_limit": 128,
"tmpfs_mb": 128,
"stdout_limit_bytes": 65536,
"stderr_limit_bytes": 65536,
"max_input_files": 10000,
"max_input_bytes": 67108864,
"module_cache": "/go/pkg/mod",
"module_cache_read_only": true,
"sqlite_driver": "digest-pinned",
"sqlite_driver_cgo": false,
"database_mode": "ephemeral",
"database_root": "/tmp/aurum-sqlite-state",
"host_database": "denied",
"extension_loading": "denied",
"remote_uri": "denied",
"implicit_persistence": "denied",
"attach_database": "denied",
"journal_mode": "memory",
"max_database_bytes": 33554432,
"max_open_connections": 4,
"busy_timeout_ms": 2000,
"query_timeout_seconds": 5,
"environment": {"GOPROXY": "off", "GOSUMDB": "off", "GONOSUMDB": "*", "GOTOOLCHAIN": "local", "CGO_ENABLED": "0", "AURUM_SQLITE_DATABASE_ROOT": "/tmp/aurum-sqlite-state", "SQLITE_TMPDIR": "/tmp/aurum-sqlite-state", "HTTP_PROXY": "", "HTTPS_PROXY": "", "NO_PROXY": "*"},
"command": ["go", "test", "-mod=readonly", "./..."]
}
